{
  "$schema":"https://json-schema.org/draft/2020-12/schema","$id":"https://ubuddy.invalid/schemas/cp-rir-d2-recovery-evidence-v0.json","type":"object","additionalProperties":false,
  "required":["$schema","schemaVersion","status","caseAlias","claims","implementationStatus"],
  "properties":{"$schema":{"const":"ubuddy-cp-rir-d2-recovery-evidence-v0.schema.json"},"schemaVersion":{"const":"cp-rir/d2-recovery-evidence/v0"},"status":{"const":"illustrative_v0_draft"},"caseAlias":{"type":"string"},"claims":{"type":"array","minItems":1,"items":{"$ref":"#/$defs/claim"}},"implementationStatus":{"const":"prototype/unverified"}},
  "$defs":{"claim":{"type":"object","additionalProperties":false,"required":["claimId","kind","effectId","sinkId","verificationStatus","checks"],"properties":{"claimId":{"type":"string","minLength":1,"maxLength":64,"pattern":"^[A-Za-z0-9._:-]+$"},"kind":{"enum":["RECEIPT","NEGATIVE_WITNESS","COMPENSATION"]},"effectId":{"type":"string","minLength":1,"maxLength":128},"sinkId":{"type":"string","minLength":1,"maxLength":128},"verificationStatus":{"enum":["NOT_IMPLEMENTED","VERIFIED"]},"checks":{"type":"object","additionalProperties":false,"required":["authority","integrity","atomicity","linearization","dedup","fencing","prePostHash"],"properties":{"authority":{"enum":["NOT_IMPLEMENTED","PASS"]},"integrity":{"enum":["NOT_IMPLEMENTED","PASS"]},"atomicity":{"enum":["NOT_IMPLEMENTED","PASS"]},"linearization":{"enum":["NOT_IMPLEMENTED","PASS"]},"dedup":{"enum":["NOT_IMPLEMENTED","PASS"]},"fencing":{"enum":["NOT_IMPLEMENTED","PASS"]},"prePostHash":{"enum":["NOT_IMPLEMENTED","PASS"]}}}}}}
}
